{"bridge":{"from":"v8","to":"v9"},"from":{"contentSha256":"65d44aa7cb8ba80cc4e93ccfd1af7dfe51bb6f7dbd8001f3880565807ca7c292","contractSha256":"67e92a98a9f7977c2447d4e2e245c31efc509d272f998e67544731ae975ce2b6"},"schemaVersion":"1.0","steps":[{"into":{"block":{"level":3,"type":"heading"},"type":"rich_text"},"op":"merge","parts":[{"source":"field_djgm2n309jzjsgwy23yq8gx2e4"},{"literal":" "},{"marks":[{"type":"italic"}],"source":"field_64sztgwr3jhn8j74j8q50r94tw"}],"target":"field_3jwcbzwrwy3ys170bxrh8r26pg"},{"into":{"block":{"level":2,"type":"heading"},"type":"rich_text"},"op":"merge","parts":[{"source":"field_rj3z8a7m5c29jzebda454ehjzr"},{"literal":" "},{"marks":[{"type":"italic"}],"source":"field_tqc63fy1zttm8c1rzvaa5qjq3w"}],"target":"field_3wwrmr3zv9g5t0wj4epvf5aryw"},{"into":{"block":{"type":"paragraph"},"type":"rich_text"},"op":"merge","parts":[{"source":"field_j73f127b1kwyxrayfvw6nzvgr0"},{"literal":" "},{"marks":[{"type":"italic"}],"source":"field_5v4zxmcnre8ypcq8j2af5hj394"}],"target":"field_4894mzdqzb7qfxk8w3zyepj8qc"},{"into":{"block":{"type":"paragraph"},"type":"rich_text"},"op":"merge","parts":[{"source":"field_mja95ypt8mk07pe8yc4d523x2r"},{"literal":" "},{"marks":[{"destination":{"fragment":null,"kind":"internal","pageId":"page_k81xhbd2nmm13hmza7rdnnphsg"},"target":"same_window","type":"link"}],"source":"field_b33spfg26q2qny24zya57aweyr"},{"source":"field_ex3p18sv2h8e83pq8539dmfvxr"}],"target":"field_5ag03dzvezj8zmpnjhj1jmkc98"},{"into":{"block":{"level":2,"type":"heading"},"type":"rich_text"},"op":"merge","parts":[{"source":"field_syee4wkf7bpt33jbeecwbe9048"},{"literal":" "},{"marks":[{"type":"italic"}],"source":"field_vqxf15zbacn9v88sqd51gqp488"}],"target":"field_69p20thbfjnn5y4472cr1etyyw"},{"into":{"block":{"level":2,"type":"heading"},"type":"rich_text"},"op":"merge","parts":[{"source":"field_bvnvncj869xe3j4d8ghhwyv2ac"},{"literal":" "},{"marks":[{"type":"italic"}],"source":"field_t5a927rj9624s7127kh7ftgrw8"}],"target":"field_7zmgz13f4cwqhqc6996hhncgg4"},{"into":{"block":{"type":"paragraph"},"type":"rich_text"},"op":"merge","parts":[{"source":"field_j1scsxavv1tvrzkfz0mkvb2y5m"},{"literal":" "},{"marks":[{"type":"italic"}],"source":"field_b4s9grg78bva383sy8zpa3nsg8"}],"target":"field_89sbj110pbpqjrzjy1cbwxyj6w"},{"into":{"block":{"type":"paragraph"},"type":"rich_text"},"op":"merge","parts":[{"source":"field_2mj08n25wc0gbdx5beqe04fn1m"},{"literal":" "},{"marks":[{"destination":{"fragment":null,"kind":"internal","pageId":"page_qdtxt2nzfc0pv8pyghtpb2wmpw"},"target":"same_window","type":"link"}],"source":"field_mwv5k0b0gey28tvpsexgmqkfbm"},{"literal":"."}],"target":"field_8rkkd0xhse71gs00wjgnyx3n28"},{"into":{"block":{"level":2,"type":"heading"},"type":"rich_text"},"op":"merge","parts":[{"source":"field_yz3axa4eyycp14k3tgdrzf4gg0"},{"literal":" "},{"marks":[{"type":"italic"}],"source":"field_bstg7pnmm92ckjtj5q99jnf6cr"}],"target":"field_9nee0wvfdm2y23mjdh4dh3jr04"},{"into":{"type":"plain_text"},"op":"merge","parts":[{"source":"field_fx7cswp0ntf7hp79ewnmy9bn7g"},{"literal":" "},{"source":"field_mvttyvbky9va30rerffs0pcrq8"}],"target":"field_9xwe3dqd8haknzmf5y0vt045e4"},{"into":{"block":{"level":2,"type":"heading"},"type":"rich_text"},"op":"merge","parts":[{"source":"field_5n1vbmdhsm6wnv3g5fmzhgav1w"},{"literal":" "},{"marks":[{"type":"italic"}],"source":"field_7k2c37gjmcxaajqe10kppr4m8r"}],"target":"field_c27g4n45w8stqpbb5gt4167xh4"},{"into":{"block":{"type":"paragraph"},"type":"rich_text"},"op":"merge","parts":[{"source":"field_t95516ctfk06dpfdzhdj41h538"},{"literal":" "},{"marks":[{"type":"italic"}],"source":"field_p9rc353tpxc0g9268zb3ch962w"}],"target":"field_cdmp4yrwjfr51sa1fvzw38zx1w"},{"into":{"block":{"level":2,"type":"heading"},"type":"rich_text"},"op":"merge","parts":[{"source":"field_a4vw66htfkp6s1qxav5m6fk96r"},{"literal":" "},{"marks":[{"type":"italic"}],"source":"field_e8kc0em60anynd6szx2az6g3v4"}],"target":"field_cgqah09y7wfar8w63ggk1ceh04"},{"into":{"block":{"level":2,"type":"heading"},"type":"rich_text"},"op":"merge","parts":[{"source":"field_3psp9bsv6gx7zq5gh651zs6nj4"},{"literal":" "},{"marks":[{"type":"italic"}],"source":"field_j1djrrc3xx08epxm2w2k5p1st8"}],"target":"field_d35c38892bp6san7wnedjm28tg"},{"into":{"block":{"level":2,"type":"heading"},"type":"rich_text"},"op":"merge","parts":[{"source":"field_ye36x1c7qghm9vtcm2vy10zcp8"},{"literal":" "},{"marks":[{"type":"italic"}],"source":"field_930j3ty760d1bv1h8vk3g0ed5r"}],"target":"field_ecagbnd38540f5g8z1jp3vf48w"},{"into":{"block":{"level":2,"type":"heading"},"type":"rich_text"},"op":"merge","parts":[{"source":"field_kx2rw5znntys6exqtnr87hfnwr"},{"literal":" "},{"marks":[{"type":"italic"}],"source":"field_5r2vktfaen8g0065v6gan503xg"}],"target":"field_esxp29bdass1agmzgpaawr35hc"},{"into":{"block":{"level":2,"type":"heading"},"type":"rich_text"},"op":"merge","parts":[{"source":"field_rhmh42eb5ryp9bs0wrd67hgz7w"},{"literal":" "},{"marks":[{"type":"italic"}],"source":"field_5s1xjth0ytjpgp2snm2a1vebv0"}],"target":"field_k7xg291cr1dqrt5vf87g8tcyqr"},{"into":{"block":{"level":2,"type":"heading"},"type":"rich_text"},"op":"merge","parts":[{"source":"field_vmqpaxrjtvcy88r2hxh5kq95k4"},{"literal":" "},{"marks":[{"type":"italic"}],"source":"field_dtttawdzzccy948fj6z760bryw"}],"target":"field_kjb50j1fw8v1qh1ntgf59pj8bc"},{"into":{"block":{"level":2,"type":"heading"},"type":"rich_text"},"op":"merge","parts":[{"source":"field_02bb25rkwm1c7q4k65r71c72nr"},{"literal":" "},{"marks":[{"type":"italic"}],"source":"field_7x8f7sfqa75ta44jh25nemvtkm"}],"target":"field_kqw56k77fmpkqb17qwn3envwv0"},{"into":{"block":{"level":2,"type":"heading"},"type":"rich_text"},"op":"merge","parts":[{"source":"field_z6zqz6cdmphgtvex1tjqr581p0"},{"literal":" "},{"marks":[{"type":"italic"}],"source":"field_33kkspv621tve3cydzc346xk00"}],"target":"field_p8c9x5jef74wf1qvany0xvsvbw"},{"into":{"type":"plain_text"},"op":"merge","parts":[{"source":"field_905fd1vj9vb0834xtwvtf6jkn4"},{"literal":" "},{"source":"field_23ykx7gg37yf0bv1d3t2g5kpvm"}],"target":"field_qf3n1zzwxzmkprgmfay86mcsmm"},{"into":{"block":{"type":"paragraph"},"type":"rich_text"},"op":"merge","parts":[{"source":"field_657srddmr63fbz7305jve0amjw"},{"literal":" "},{"marks":[{"destination":{"fragment":null,"kind":"internal","pageId":"page_k81xhbd2nmm13hmza7rdnnphsg"},"target":"same_window","type":"link"}],"source":"field_whxdcttag2j58r087gp6wmnnm8"},{"literal":"."}],"target":"field_qhbzxyghcvcknwd3by36qcgpbc"},{"into":{"block":{"type":"paragraph"},"type":"rich_text"},"op":"merge","parts":[{"source":"field_8czg1x5gjxn1059qzy3vfzegy0"},{"literal":" "},{"marks":[{"type":"italic"}],"source":"field_22v1cshmxqe2rw5kc9bn8g3e6c"}],"target":"field_s2ra4q3wn9adpfcra9cs0c2dvg"},{"into":{"block":{"level":2,"type":"heading"},"type":"rich_text"},"op":"merge","parts":[{"source":"field_77pa8qt3jhga71z5ac5enxtntc"},{"literal":" "},{"marks":[{"type":"italic"}],"source":"field_dh1f1x2mmvq2pm8443vq1qxtac"}],"target":"field_sv40g1vpnhrav6ca27c2erfv5w"},{"into":{"block":{"level":2,"type":"heading"},"type":"rich_text"},"op":"merge","parts":[{"source":"field_1q6cjnc6prxf0qk5a569afm5jc"},{"literal":" "},{"marks":[{"type":"italic"}],"source":"field_2m85pqn5sjg7mq2zk5p0ay8kp4"}],"target":"field_swryz00t413sqbnck1yzey93z0"},{"into":{"block":{"type":"paragraph"},"type":"rich_text"},"op":"merge","parts":[{"source":"field_d9xsb4fqd9xq2k78jrr0svh2fw"},{"literal":" "},{"marks":[{"destination":{"fragment":null,"kind":"internal","pageId":"page_k81xhbd2nmm13hmza7rdnnphsg"},"target":"same_window","type":"link"}],"source":"field_z6v713ma0bn7y5k7fdykjvnsa8"},{"literal":"."}],"target":"field_tk0r2056bg83jtvsvja2xewfww"},{"into":{"block":{"level":2,"type":"heading"},"type":"rich_text"},"op":"merge","parts":[{"source":"field_hjrvkq30fdykejz9dxfaq63kgc"},{"literal":" "},{"marks":[{"type":"italic"}],"source":"field_3w9xr3k0ky5exnrffeaate0ezr"}],"target":"field_tmqsp3syt6bvckqspz2sravker"},{"into":{"block":{"level":2,"type":"heading"},"type":"rich_text"},"op":"merge","parts":[{"source":"field_9shmqwe6e82q7f4bv05tje19kc"},{"literal":" "},{"marks":[{"type":"italic"}],"source":"field_jjzd32bbrnzxvr70kwbpfbnp48"}],"target":"field_wd1pqa49m25zdazmmtdnzdeq9g"},{"into":{"block":{"type":"paragraph"},"type":"rich_text"},"op":"merge","parts":[{"source":"field_wn168qvqxdeesw03raxe3zzfjm"},{"literal":" "},{"marks":[{"type":"italic"}],"source":"field_fag30jmx9v39jx1t3tra0ctbt8"}],"target":"field_wqg9ysf07v1s96qam2fzgeffy0"},{"into":{"block":{"level":2,"type":"heading"},"type":"rich_text"},"op":"merge","parts":[{"source":"field_a9zahzdedrgm6b04rxf34bx98g"},{"literal":" "},{"marks":[{"type":"italic"}],"source":"field_xqtbf6qzv9rkq9rvzy6fmg5kmr"}],"target":"field_ysgbb2typdec34dddsqcaf380w"},{"into":{"block":{"level":2,"type":"heading"},"type":"rich_text"},"op":"merge","parts":[{"source":"field_eg19zrgjtk7ycppvr587xgfyem"},{"literal":" "},{"marks":[{"type":"italic"}],"source":"field_wy6q9byf5d522c79jfbjvaf1fg"}],"target":"field_yvbx2b8f2zmwrw69bxpb43wse0"},{"into":{"block":{"level":2,"type":"heading"},"type":"rich_text"},"op":"merge","parts":[{"source":"field_1a405c5g3x65m90n7tphx02tj4"},{"literal":" "},{"marks":[{"type":"italic"}],"source":"field_xcynrc6gtjpmt68e7fy7a0gx40"}],"target":"field_yx72bfq7sw3rt0aytf1nh0rhcg"},{"into":{"block":{"level":2,"type":"heading"},"type":"rich_text"},"op":"merge","parts":[{"source":"field_29d8w7ergkj921dyq1xg48r0fc"},{"literal":" "},{"marks":[{"type":"italic"}],"source":"field_vhfcz5bgymwb8kwn9q4s1rq7e0"}],"target":"field_zj2sb25692x4v5sktkgq4e3994"},{"into":{"block":{"level":2,"type":"heading"},"type":"rich_text"},"op":"merge","parts":[{"source":"field_jzf8vx081m037a5xk436at1g4r"},{"literal":" "},{"marks":[{"type":"italic"}],"source":"field_bsszt8n8q5n8nnx37kgkn4rr54"}],"target":"field_zv5hzpb8f9j6nqn9rd7m366a90"}]}
